{
  "about": "What Animundo is missing, most wanted first in each list. tools/catalogue.py turns this and the game's data into docs/catalogue.md. When something is added, its row shows as done; then delete it here. status: wanted, in_progress (say who), check (something to decide first) or later.",
  "animals": [
    {"id": "mountain_hare", "name": "Mountain hare", "local": "metsäjänis", "latin": "Lepus timidus", "place": "fi_nuuksio", "feeds": "Fox, later lynx and eagle owl", "needs": "New model from a spec, with a white `winter` coat. It replaces the \"rabbit\": European rabbits don't live wild in Nuuksio (ART.md: real species only).", "status": "wanted"},
    {"id": "", "name": "Young perch and young roach", "local": "ahvenen ja särjen poikaset", "latin": "", "place": "fi_nuuksio", "feeds": "Perch (its main food from summer on: perch eat small fish, even young perch), pike", "needs": "No new model: the perch and roach models at baby size, from the baby stage (decision 0010). Tag `fry`; the perch then `hunts: [\"fry\"]`. Code: hunters only catch prey much smaller than themselves, and the player's fish can chase fish.", "status": "wanted"},
    {"id": "common_frog", "name": "Common frog", "local": "sammakko", "latin": "Rana temporaria", "place": "fi_nuuksio", "feeds": "Pike (spring), fox, later heron", "needs": "New model. Code: an animal that lives on land and in water (a new archetype).", "status": "wanted"},
    {"id": "common_lizard", "name": "Common lizard", "local": "sisilisko", "latin": "Zootoca vivipara", "place": "fi_nuuksio", "feeds": "Kestrel (summer)", "needs": "New model. Cold-blooded, basks on sunny rocks.", "status": "wanted"},
    {"id": "chaffinch", "name": "Chaffinch, with eggs and nestlings", "local": "peippo", "latin": "Fringilla coelebs", "place": "fi_nuuksio", "feeds": "Fox (spring: birds and eggs), later sparrowhawk", "needs": "New model. Tag `small_bird`. Code: nests with eggs and young.", "status": "wanted"},
    {"id": "", "name": "Night animals: bats and owls", "local": "lepakot ja pöllöt", "latin": "", "place": "fi_nuuksio", "feeds": "", "needs": "Code first: how night works has to be tested before the first night animal (decision 0014, open). See docs/animals-wanted.md.", "status": "later"}
  ],
  "plants": [
    {"id": "wild_raspberry", "name": "Wild raspberry", "local": "vadelma", "latin": "Rubus idaeus", "place": "fi_nuuksio", "feeds": "Fox, squirrel (`berries`: players are already told they ate wild raspberries)", "needs": "Data only. Clearings, forest edges, old fields. About 1–1.5 m of upright canes, `kind: \"bush\"`. White flowers in June, red berries July–August.", "status": "wanted"},
    {"id": "crowberry", "name": "Crowberry", "local": "variksenmarja", "latin": "Empetrum nigrum", "place": "fi_nuuksio", "feeds": "Fox, squirrel (`berries`: players are already told they ate crowberries), later birds", "needs": "Data only. Rocky hilltops and pine heath with heather (`on: [\"grass\", \"rock\"]`). A low evergreen mat; black berries from August that stay into winter.", "status": "wanted"},
    {"id": "red_clover", "name": "Red clover and white clover", "local": "puna-apila, valkoapila", "latin": "Trifolium pratense", "place": "fi_nuuksio", "feeds": "Hare (`clover`: players are already told they ate clover), bumblebee", "needs": "Data only for the look: meadows, roadsides, around old farms, not inside the forest. Two specs, one per species. Code to be the bee's flowers (see core team work).", "status": "wanted"},
    {"id": "", "name": "Wild carrot: check first", "local": "porkkana", "latin": "Daucus carota", "place": "fi_nuuksio", "feeds": "Hare (`carrot`)", "needs": "Rare in Finland, only a few places on the south coast, so it probably shouldn't be in Nuuksio. Decide with the core team whether to replace the `carrot` food with plants hares really eat there (grasses, herbs, willow twigs).", "status": "check"},
    {"id": "goat_willow", "name": "Goat willow (as a shrub)", "local": "raita", "latin": "Salix caprea", "place": "fi_nuuksio", "feeds": "Bumblebee (catkins are its first food, April–May), hare (twigs and bark in winter)", "needs": "Data only for the shrub: forest edges, clearings, lake shores. Code: bee food from a plant, and winter browse for hares.", "status": "wanted"},
    {"id": "wavy_hair_grass", "name": "Wavy hair-grass", "local": "metsälauha", "latin": "Avenella flexuosa", "place": "fi_nuuksio", "feeds": "Hare and voles (grass)", "needs": "Data only, `kind: \"ground\"`. The commonest grass of dry forest floor. Could replace the generic grass tuft inside the forest.", "status": "wanted"},
    {"id": "chanterelle", "name": "Chanterelle", "local": "kantarelli", "latin": "Cantharellus cibarius", "place": "fi_nuuksio", "feeds": "Squirrel (mushrooms)", "needs": "Data only, `kind: \"ground\"`. Mossy spruce and mixed forest, July–September.", "status": "wanted"},
    {"id": "fireweed", "name": "Fireweed", "local": "maitohorsma", "latin": "Chamaenerion angustifolium", "place": "fi_nuuksio", "feeds": "Bumblebee (summer nectar), hare", "needs": "Data only. Clearings, burnt and open ground, roadsides. Up to 1.5 m: pink spikes July–August, red leaves and white seed fluff in autumn.", "status": "wanted"},
    {"id": "wood_anemone", "name": "Wood anemone", "local": "valkovuokko", "latin": "Anemone nemorosa", "place": "fi_nuuksio", "feeds": "Early insects", "needs": "Data only, `kind: \"ground\"`. Leafy groves and herb-rich spruce forest. White flowers in early May, gone by midsummer.", "status": "wanted"},
    {"id": "reindeer_lichen", "name": "Reindeer lichen", "local": "poronjäkälä", "latin": "Cladonia rangiferina", "place": "fi_nuuksio", "feeds": "", "needs": "Data only, `kind: \"ground\"`, `on: [\"rock\"]`. Pale grey-green mats on rocky pine hilltops, the same all year.", "status": "wanted"},
    {"id": "feathermoss", "name": "Red-stemmed feathermoss", "local": "seinäsammal", "latin": "Pleurozium schreberi", "place": "fi_nuuksio", "feeds": "Nest lining for squirrels and birds", "needs": "Data only, `kind: \"ground\"`. Green carpets under spruce, nearly everywhere.", "status": "wanted"},
    {"id": "juniper", "name": "Juniper", "local": "kataja", "latin": "Juniperus communis", "place": "fi_nuuksio", "feeds": "Birds (berry-cones), later", "needs": "Data only, `kind: \"bush\"`. Rocky pine heath and dry slopes. Evergreen; berry-cones take two years to ripen from green to blue-black.", "status": "wanted"},
    {"id": "bracken", "name": "Bracken", "local": "sananjalka", "latin": "Pteridium aquilinum", "place": "fi_nuuksio", "feeds": "", "needs": "Data only, `kind: \"bush\"`. Spruce and mixed forest. Fronds unroll in late May, turn brown in autumn and die back in winter; long `leaf` shapes make the fronds.", "status": "wanted"},
    {"id": "spiny_wood_fern", "name": "Spiny wood fern", "local": "metsäalvejuuri", "latin": "Dryopteris carthusiana", "place": "fi_nuuksio", "feeds": "", "needs": "Data only, `kind: \"bush\"`. Damp spruce forest.", "status": "wanted"},
    {"id": "lily_of_the_valley", "name": "Lily of the valley", "local": "kielo", "latin": "Convallaria majalis", "place": "fi_nuuksio", "feeds": "", "needs": "Data only, `kind: \"ground\"`. Dry leafy groves and forest edges. White bells in June, poisonous red berries in autumn. Finland's national flower.", "status": "wanted"},
    {"id": "peat_moss", "name": "Peat moss", "local": "rahkasammal", "latin": "Sphagnum", "place": "fi_nuuksio", "feeds": "", "needs": "Code first: bog ground in the terrain.", "status": "later"},
    {"id": "cloudberry", "name": "Cloudberry", "local": "lakka", "latin": "Rubus chamaemorus", "place": "fi_nuuksio", "feeds": "Fox, birds", "needs": "Code first: bog ground. Orange berries in July.", "status": "later"},
    {"id": "labrador_tea", "name": "Labrador tea", "local": "suopursu", "latin": "Rhododendron tomentosum", "place": "fi_nuuksio", "feeds": "", "needs": "Code first: bog ground. White flowers in June.", "status": "later"},
    {"id": "cottongrass", "name": "Hare's-tail cottongrass", "local": "tupasvilla", "latin": "Eriophorum vaginatum", "place": "fi_nuuksio", "feeds": "Hare (early spring shoots)", "needs": "Code first: bog ground. White fluffy heads in late May and June.", "status": "later"}
  ],
  "trees": [
    {"id": "", "name": "Aspen, grey alder, goat willow as trees", "local": "haapa, harmaaleppä, raita", "latin": "", "place": "fi_nuuksio", "feeds": "Hare (bark and twigs), beaver later", "needs": "Code: trees are still made in code. Trees as data recipes are undecided (decision 0013): measure first.", "status": "later"}
  ],
  "foods": [
    {"id": "", "name": "Spruce cones and seeds", "local": "kuusenkävyt", "feeds": "Squirrel (its main food autumn to spring)", "needs": "Code: a new food kind.", "status": "wanted"},
    {"id": "", "name": "Mushrooms", "local": "sienet", "feeds": "Squirrel (summer and autumn; it dries them on branches)", "needs": "Code: a new food kind that uses the mushroom plants.", "status": "wanted"},
    {"id": "", "name": "Bark, twigs and buds", "local": "kuori, oksat, silmut", "feeds": "Mountain hare (winter)", "needs": "Code: a new food kind.", "status": "wanted"},
    {"id": "", "name": "Carrion", "local": "raato", "feeds": "Fox (winter)", "needs": "Code: a new food kind.", "status": "wanted"},
    {"id": "", "name": "Grass and herbs", "local": "heinä ja ruohot", "feeds": "Hare (its main food in summer)", "needs": "Code: a new food kind, grazing the meadow's grass tufts. Today a hare only finds clover and wild carrot.", "status": "wanted"},
    {"id": "", "name": "Worms, snails and larvae in the mud", "local": "madot, kotilot ja toukat pohjamudassa", "feeds": "Bream (its main food: it sucks them from the bottom), roach", "needs": "Code: a new food kind on the lake bottom, found by digging in the mud. Today bottom feeders eat the water insects drifting in open water.", "status": "wanted"},